title,text,subject,date
BJP asks cadre to join in relief and rehabilitation works,"Telangana BJP president N. Ramchander Rao on Thursday directed party workers to join in relief works immediately in rain affected areas of the State. In a tele-conference with booth- level presidents, district presidents, office-bearers and corporators, he asked them to participate in relief works and cooperate with official machinery involved in evacuating people from low-lying areas, and in distribution of food and drinking water to the needy. He urged people to be vigilant due to heavy rains lashing across Telangana in view of a warning of heavy to very heavy rains in several districts, and a red alert has been issued in Medak and Kamareddy districts. People should take precautions and avoid going out unless it is an emergency as some streams and lakes are overflowing and roads in some areas have been submerged, he said. The Central government has given assurance to help Telangana in relief and evacuation of people from low-lying areas to safer places. Union Minister Rajnath Singh (Defence) and party’s national president J P Nadda spoke to Mr. Rao to",sports,28-Aug-25
"Mamkootathil’s suspension meaningless, says Brinda Karat","Communist Party of India (Marxist) [CPI(M)] leader Brinda Karat has accused Leader of the Opposition V.D. Satheesan of defending “disgraced” Palakkad MLA Rahul Mamkootathil, who was suspended from the Congress party following allegations of sexual misconduct. She told the media here on Thursday (August 28, 2025) that “a serious sexual harasser and offender” was being “defended and supported” by the Leader of the Opposition from the Congress. “You suspended an MLA obviously because you found that he had indeed done something wrong. Otherwise, why did you suspend him? Because you accept that what he has done is totally condemnable and unacceptable. But simultaneously you defend him... Certainly, action must be taken against him,” Ms. Karat said. On the Congress party’s claim that it had taken action against Mr. Mamkootathil despite receiving a written complaint, she said the party suspended him because it knew there was prima facie evidence of the sexual misconduct he had committed. “So, on the one hand, you want to say we have taken action against him, and on the other, you stand up and defend him. This is utter hypocrisy. Not only that, it is an insult to the women of Kerala. When you are defending a serious sexual offender, the six-month suspension is meaningless. The United Democratic Front and the Leader of the Opposition are singularly responsible for insulting the women of Kerala,” Ms. Karat said. Published - August 28, 2025 11:49 pm IST",health,28-Aug-25
More labourers to be deployed for NH repair works in Kozhikode,"The total workforce will be increased soon to speed up the ongoing National Highway widening works and service road repairs in Kozhikode district. The move follows a recent discussion initiated by people’s representatives in the presence of National Highways Authority of India (NHAI) officials. Various local action committees alleged that the work was being delayed due to the inadequate workforce at the sites. Though several committees had taken up the matter with NHAI officials, they had not received any assurance from the higher authorities. According to NHAI sources, the latest decision is to complete all emergency road repairs on NH-66 within a week. The proposed works will mainly address issues raised by residents at Thiruvangoor, Vengalam, Chengottukavu, Nandi, Payyoli, Iringal, and Vadakara. “Traffic diversion is also under consideration in some of the accident-prone stretches to support the works. It will be implemented with prior notice to the public,” said an engineer supervising the project. He added that the contractors were aware of public concerns and would ensure the completion of all entrusted works within a week. Meanwhile, engineers from the road contracting company in Kozhikode district expressed concerns over adverse weather conditions, which they said could hamper meeting the deadlines. They added that the number of labourers would be increased soon following recent discussions with NHAI officials, but the timely completion of the works would depend on the weather. Since the onset of the monsoon, private bus operators have been up in arms over the poor condition of service roads on the Kozhikode–Kannur National Highway. According to them, the rough, pothole-ridden roads have caused numerous mechanical problems. They also complained about reduced mileage due to frequent traffic snarls. “Night riding has become a dangerous task for motorists on the national highway due to the",environment,28-Aug-25
Kamareddy flood | Moisture from Bay of Bengal and wind from Arabian Sea brought deluge: IMD scientist,"In these days of nowcast and hourly zone-wise alerts about rainfall, the viral videos of the flooding in Kamareddy of Telangana and rescue operations shared by government officials and residents came as a shock to people. A scientist from India Meteorological Department (IMD) said that a red alert has been in place for the district for 24 hours. “It was more of a routine alert, without being specific on the intensity, in terms of orange/red category,” said a State government official when",environment,28-Aug-25
103-year-old Pocharam project stands tall amid flood fury,"It was nothing short of a miracle that 103-year-old Pocharam project on Allair river in Nagireddypet mandal of Kamareddy district withstood the flood fury of 1.82 lakh cusecs inflow as against the maximum flood discharge capacity of 70,000 cusecs. The raging flood waters due to heavy rain in its catchment area on Sunday saw Pocharam project receiving unprecedented flood. With water overflowing alarmingly and the bund on the Kamareddy side showing signs of giving away, district administration",technology,28-Aug-25
"Rains damage 387 transformers, 1,465 poles; many restored on war-footing","HYDERABAD A total of 1,465 electric poles and 387 distribution transformers in the limits of Southern and Northern power distribution companies were damaged in the incessant rains across the State since Tuesday, and the field staff of the two utilities are engaged in replacing/repairing the damaged installations. Chairman and Managing Director of the Southern Power Distribution Company of Telangana Ltd (TGSPDCL) Md. Musharraf Faruqui said",environment,28-Aug-25
Pre-test for Census 2027 to be conducted in October-November,"The pre-test exercise for the Population Census, 2027 will be conducted in October and November this year, the Registrar General and Census Commissioner (RG & CCI) have informed the Directorates of Census Operations (DCOs) in the States. A pre-test is required to test the efficacy of the entire exercise that will be held in two phases — Houselisting and Housing Schedule (HLO) and Population Enumeration — between April 1, 2026 and February 28, 2027. This will be the first digital Census and the first to enumerate caste in independent India. Trial exercise The test will evaluate the proposed questions, data collection methodologies, training effectiveness, logistics, printing processes, and data quality assessment and identify potential field issues. Registrar General of India Mrityunjay Kumar Narayan is learnt to have informed the DCOs in the States. The DCOs have been told that a mobile app will be used for the first time to collect data. Other aspects such as self-enumeration, digital mapping tools, and a web-based portal for real-time monitoring and management will also be tried out during the pre-test, the DCOs were informed. Phase 1 questions only This is the first Census since 2011 as the exercise that was scheduled for 2021 was delayed, initially due to the COVID-19 pandemic. It will now be completed in 2027. The pre-test for the planned 2021",politics,28-Aug-25
