title,text,subject,date
RTA told to take steps to increase time gap between private buses,"The Kerala High Court has directed the Regional Transport Authority (RTA) to take effective steps to prevent reckless driving by private buses in Kochi, including by increasing the time gap between buses that operate on the same routes. The Transport department had mulled increasing the time gap between buses on the same routes in urban areas to a minimum of five minutes and in rural areas to 10 minutes to prevent undue competition and subsequent reckless driving that often resulted in accidents. The High Court expressed angst at the RTA meeting not being convened so far, although it had ordered on August 8 to convene it within a fortnight. The government pleader said that a meeting had now been planned for September 29. Traffic police The court further said that traffic police personnel could be deployed at junctions on arterial stretches like Banerjee Road-Palarivattom and Pallimukku-Vyttila, instead of relying on signal lights at junctions, to lessen traffic congestion. Using walkie-talkies, personnel would be able to communicate with one another, ensuring better traffic management. An amicus curiae report in this regard was submitted to the District Police Chief (Kochi City). The court said that police personnel would be able to help streamline traffic flow, depending on the",health,28-Aug-25
Elderly couple found dead in Kannur,"An elderly couple, reportedly relatives of Forest Minister A.K. Saseendran, were found burnt to death at their house at Alavil, Kannur, on Thursday (August 28, 2025) evening. The deceased were identified as Premarajan, 75, and his wife Sreelekha, 69. The incident came to light around 5 p.m. when their driver failed to get a response after repeatedly calling them. He alerted neighbours, and on inspection noticed the fire. On entering inside, the charred bodies of the couple were reportedly found. The police have registered a case of unnatural death. Published - August 29, 2025 01:45 am IST",environment,28-Aug-25
"Questions in Justice Nagarathna’s dissent remain even as Justices Aradhe, Pancholi to be sworn in as Supreme Court judges on August 29","Questions raised by Justice B.V. Nagarathna in a dissent to the elevation of Justice Vipul Manubhai Pancholi to the Supreme Court remain even as Chief Justice of India B.R. Gavai is scheduled to read the oath of office to the judge and Justice Alok Aradhe on Friday (August 29, 2025). The lone woman apex court judge’s questions in her dissent included the reasons behind the transfer of Justice Pancholi from Gujarat to Patna in July 2023 and why a team of senior lawyers had urgently sought a meeting with then Chief Justice of India D.Y. Chandrachud (now retired) in the presence of Justice M.R. Shah (retired), a then apex court judge whose parent High",science,28-Aug-25
Chengalpattu farmers want paddy DPCs to be opened soon for Sornavari crop,"Farmers of Chengalpattu have urged the government to open direct procurement centres (DPCs) for the Swarnavari (or Sornavari) paddy season, which is almost nearing completion. Around 13,500 hectares are under cultivation this year under Swarnavari in the district. Seeds are sown for Swarnavari in April and harvest happens in August - September. R. Muralimohan of the Chengalpattu District Farmers Association said many farmers have harvested their crop and were worried about it getting wet and thereby losing colour. “Farmers will have to dry the paddy again. If there is increased moisture in the paddy, it will lead to farmers having to sell to traders. There is a backlog of",environment,28-Aug-25
Bihar police officers to get ?1.50 crore insurance in case of death on duty,"In Bihar, if police personnel die in an accident during duty, they will get the benefit of insurance of ?1.50 crore. Additional Director General (ADG- Budget, Appeal and Welfare) Dr. Kamal Kishore Singh shared the information at a press conference on Thursday (August 28, 2025) in the auditorium of Police Headquarters Sardar Patel Bhawan. Mr. Singh said that a few months ago, a vehicle crushed a woman constable during vehicle checking on Atal Path in Patna. The woman cop was hit hard and succumbed to her injuries during treatment. “She is being given an insurance benefit of ?1.5 crore. She is the first police personnel to get benefits under this new facility,”Mr. Singh said. The ex-gratia by the government is given to a dependent family in addition to other facilities including jobs. He further said, “In addition to government facilities for police personnel, charitable funds, education fund and health fund have been formed at the department level. Financial assistance is provided to needy police personnel from this from time to time. Fifty-three people will be given assistance of Rs 6.84 lakh from the charitable fund. Now the children of policemen will get assistance for education up to PG level from the education fund. Earlier assistance was given only up to graduate level.” In case of untimely death, the family members of the concerned police personnel are given ?24000 annually from the Police Assistance Welfare Fund. “This year, an amount of ?32 lakh is",technology,28-Aug-25
VIT Chennai signs 7 MoUs and patent commercialisation agreement at industry-academia summit,"VIT Chennai on Thursday signed seven Memoranda of Understanding (MoUs) and a patent commercialisation agreement at its Industry-Academia Innovators Conclave to mark its 15-year celebrations. While the MoUs would aim to train students in robotics, automation, and network security, including quality concepts and shop-floor practices, the patent transfer agreement signed with Chennai-based Datayaan Solutions would allow VIT’s water quality assessment technology to be scaled up to be used commercially. Themed ‘Smart Mobility, Sustainable Manufacturing, and Automation for a Resilient Future’, the two-day conclave brought together 48 industry experts, over 140 industry participants, and 55 academicians. At the inaugural event, A.S. Ramadoss, director, Global Automotive Research Centre, pointed out real-world challenges such as supply chain disruptions witnessed during the pandemic, semiconductor shortages, and the scarcity of rare materials for electric vehicles while emphasising that collective problem-solving between industry and academia can lead to breakthroughs with transformative global impact. Samba Moorthy, president, Epson India, said history held the key to modern day data",health,28-Aug-25
Acting DGP to head Tamil Nadu police force till Shankar Jiwal’s successor is appointed,"With incumbent Director-General of Police/Head of Police Force Shankar Jiwal set to retire from service on August 31, 2025, the State government may go ahead posting an ad hoc DGP till a full-time officer is appointed in compliance with the Supreme Court guidelines. Since a proposal comprising the list of DGP-rank officers qualifying to the top post was not sent to the Union Public Service Commission (UPSC) within the stipulated time, the State is left with no other option but to appoint an officer to hold additional charge of DGP/HoPF. The Supreme Court had ruled in the Prakash Singh case that, “all the States shall send their proposals in anticipation of the vacancies to the UPSC well",science,28-Aug-25
A dream derailed,": In the puzzle to solve Bengaluru’s traffic nightmare, the long-delayed Bengaluru Suburban Railway Project (BSRP) was billed as the third pillar of public transport after Bangalore Metropolitan Transport Corporation (BMTC) and Namma Metro. The project was sanctioned in October 2020 after decades of deliberation and was designed to carry nearly 20 lakh commuters every day across Bengaluru and its outskirts. It envisaged modern nine-coach air-conditioned trains running at high frequencies of five to 12 minutes along four corridors stretching 148 kilometres and covering 58 stations. The sanctioned cost of ?15,767 crore was seen as an investment in not only mobility, but also economic efficiency and environmental sustainability. Corridor One, running between Majestic and Kempegowda International Airport, was given priority and was originally scheduled to be completed by October 2023, well ahead of the full project deadline of October 2026. 3 years on, little progress When Prime Minister Narendra Modi laid the foundation stone in June 2022, he assured citizens that the 148-km network would be delivered within 40 months, ending a 40-year wait. That announcement had generated a wave of optimism across Bengaluru, where traffic congestion has long been a daily torment. Yet, more than three years after the sanction, the reality is starkly different. Progress on the ground has been very slow. The project",environment,28-Aug-25
Telangana explains KWDT-II on how water drawal from Nagarjunasagar to Andhra enhanced,"HYDERABAD The combined Andhra Pradesh dispensation has reduced the ayacut under Nagarjunasagar project in the Telangana region and increased the same in Andhra region only to bring down the water requirement in Telangana with a view to avail more water, Telangana submitted to the Krishna Water Disputes Tribunal-II headed by Justice Brijesh Kumar. Presenting the case of Telangana before the Tribunal as part of the ongoing arguments over the Section 3 reference made by the Centre to it (Tribunal) for reapportionment of water out of the combined allocation of 811 tmcft of assured water and also surplus water",environment,28-Aug-25
Jammu and Kashmir High Court grants U.T. government 20 days to submit final stand on Gulmarg lease issue,"The Jammu and Kashmir High Court on Thursday (August 29, 2025) granted 20 days to the Union Territory government to submit its final stand on the Gulmarg lease issue, in the wake of the Raj Bhawan and the Chief Minister’s office taking two separate positions. Dozens of hoteliers are unable to extend their lease period after the Lt.-Governor’s administration replaced the rules for lease with a new one in 2022. The Division Bench, comprising J&K Chief Justice Arun Palli and justice Rajnesh Oswal, decided to hear the Gulmarg lease issue again on September 17, while passing the direction to the U.T. government to submit its final stand. The direction came after the court perused the two separate stands submitted to the judges from the Raj Bhawan and the Chief Minister’s office in a sealed cover for the second time. The Raj Bhawan’s stand was submitted through the Additional Advocate General and the CM’s stand through the Special Secretary, Law Department. The two positions, in sealed covers, were presented by the Additional Advocate General and opened to take note of the stands taken by the two top offices of J&K. The court held that the stand of the government of the UT, as envisaged under the Reorganisation Act 2019, should submit “an overt stand” in the next hearing. The court hinted that it is unlikely to entertain the sealed cover stands submitted by the Raj Bhawan and the office of the Chief Minister. User charges Meanwhile, the court also directed the occupants to",science,28-Aug-25
"No disposal roadmap, growing resistance from operators turn Hyderabad’s cable cleanup drive into a tangle","On Hyderabad’s streets, coils of severed black cable lie abandoned in corners and along pavements, stark reminders of a frantic drive by the electricity department to strip away dangling broadband and cable TV wires from power poles. What began as a safety measure after a spate of fatal electrocutions has now turned into a messy tussle between officials and cable",business,28-Aug-25
Rajasthan High Court cancels 2021 Sub-Inspector exam over paper leak,"The Rajasthan High Court on Thursday cancelled the police Sub-Inspector recruitment examination of 2021 after finding large-scale irregularities, including paper leak and involvement of members of the State Public Service Commission (RPSC) in the scam. The court declared null and void the exam as well as the selection of Sub-Inspectors. Justice Sameer Jain at the High Court’s Jaipur Bench, who had earlier reserved the judgment after a prolonged hearing on a writ petition filed by 25 individuals, pronounced the verdict in the open court, while observing that the examination process was vitiated by “illegality and fraud on the system”. The court criticised the State government for its inaction, pointing out that despite glaring evidence, no decisive steps were taken. The BJP government had opposed the writ petition, saying it would be premature to cancel the exam before the Special Operations Group (SOG) of the Rajasthan police completes its probe. A Cabinet Sub-Committee, which examined various aspects of the recruitment exam, had also recommended against cancellation. It said only 6.3% of examinees were found to be tainted in the SOG probe, while 93.7% appeared to be clean. The recommendation was approved by Chief Minister Bhajan Lal Sharma. Multiple first information reports were registered in connection with the recruitment exam held in September 2021 to fill 859 vacancies of Sub-Inspectors and platoon commanders. A total of 122 people, including 55 trainees and two members of RPSC, were arrested in the case. Several of those arrested allegedly acted as dummy candidates and engaged",environment,28-Aug-25
First pier cap of Kochi metro’s ‘Pink Line’ launched near Infopark,"The first pier cap of the Kochi metro’s 11.20-km-long Kakkanad extension (christened ‘Pink Line’) was launched on Thursday (August 28, 2025), atop pillar number 281 near Infopark. The 80-tonne pier cap that was cast at the yard of Kochi Metro Rail Limited (KMRL) in Kalamassery was launched with the help of a heavy-duty crane. In the coming days, pier caps will be launched atop three other adjacent pillars, up to pillar number 284, metro sources said. Altogether, 22 pillars have been built on the proposed alignment, while a total of 898 piles have been readied. A total of 56 pier caps, 64 U-girders, and 30 I-girders have been readied so far at the casting yard, they",sports,28-Aug-25
DPR study on extending Kochi metro to Angamaly begins,"A study for preparing the detailed project report (DPR) on extending the Kochi metro from Aluva to Angamaly via Cochin international airport has begun. Haryana-based Systra MVA Consulting India Private Limited is preparing the DPR at a cost of ?1.03 crore. The company has been instructed to submit the document within six months, according to a Kochi Metro Rail Limited (KMRL) release. KMRL managing director Loknath Behera said the study marked the beginning of the fulfilment of the long-pending demand to connect the metro to the international airport and extend it further to Angamaly. The proposed elevated line will be 17.5 km long with a portion of it planned as an underground stretch. Detailed field investigation, surveys, and engineering",health,28-Aug-25
"Entire village in Bihar shown residing in one house, claims Rahul","Congress leader Rahul Gandhi fired a fresh salvo at the Election Commission of India on Thursday (August 28, 2025), claiming that the draft electoral rolls in Bihar show ""an entire village"" in Gaya district to be ""residing in the same house"". The Leader of Opposition in Lok Sabha, who is carrying out a ‘Voter Adhikar Yatra’ across the state, shared a social media post of his party, with the remark ""see the magic of EC. An entire village has settled down in one house"". The Congress' post on X said that in Nidani village of Gaya district, under Barachatti assembly segment, ""all 947 voters"" of a booth have been shown to be ""residents of house number six"". ""This is about just one village. We can only imagine the scale of irregularities on the state and national level,"" the party said. However, the office of the Chief Electoral Officer of Bihar came out with a clarification issued on the X handle of the District Magistrate of Gaya. The DM claimed ""notional house number is given in villages or slum clusters where the houses do not have any actual serial numbers. This is done for making easy the process of enlisting voters"". Video clips, purportedly of residents of the village, have also been shared on the DM's X handle in which the people can be heard saying they were satisfied with the special intensive revision of electoral rolls, but upset over ""attempts to defame the area"". Published - August 29, 2025 12:04 am IST",technology,28-Aug-25
"Couples choosing ‘love marriage’ face many challenges, says Udhayanidhi","Presiding over the wedding of an inter-caste couple in Chennai, Deputy Chief Minister Udhayanidhi Stalin on Thursday listed the challenges faced by couples when they go in for a ‘love marriage’. “You all know how difficult it is in a love marriage. And I am very well aware [of it]. Initially, the man and the woman should be united in love. After the man convinces the woman and the woman convinces the man, they have to convince each others’ parents to make them accept [their decision],” Mr. Udhayanidhi said. The couple would have to obtain the consent of not only their parents, but also members of their extended family, he said. “Many of them would say a love marriage is not suitable for their family. [They would say] ‘we don’t know about the man and what his educational qualifications are’, and the same goes for the",environment,28-Aug-25
"CPI(M), UDF lock horns over protests against Shafi Parambil in Kozhikode","The Congress-led United Democratic Front (UDF) and the Communist Party of India (Marxist) [CPI(M)] are coming face to face in Kozhikode district over attempts by Democratic Youth Federation of India (DYFI) activists to corner Vadakara MP Shafi Parambil, alleging that he was “protecting” Palakkad MLA Rahul Mamkootathil, who has been accused of sexual misconduct. Though district DYFI leaders claimed that the organisation had not officially decided to disrupt events attended by Mr. Parambil, the MP faced the ire of local activists twice in the past week. The tipping point came on August 27, when his vehicle was waylaid by DYFI cadre as he was leaving an Onam event for differently abled children. Heated arguments followed, with Mr. Parambil stepping out of his car and alleging that the activists hurled abuse at him. However, local DYFI leaders later contended that the provocation originated from one of Mr. Parambil’s aides inside the vehicle. Subsequently, youth organisations aligned with the UDF, along with leaders of its ally, the Revolutionary Marxist Party of India (RMP), including Vadakara MLA K.K. Rema, took to the streets in Vadakara and Perambra. Amid the melee, allegations surfaced that V.P. Dulkhifil, Kozhikode district panchayat member and Youth Congress State general secretary, was manhandled by the police. The Congress and the UDF view the protests as a direct attack on Mr. Parambil, who trounced CPI(M) veteran K.K. Shailaja in its stronghold Vadakara in the 2024 Lok Sabha polls. The CPI(M), meanwhile, is stepping up its ground-level campaign against the MP, reportedly portraying",culture,28-Aug-25
Another low pressure off Bay of Bengal likely to bring in more rain,"More rainfall is in store over the coming days, with another weather system - a low-pressure area - expected to form in the Bay of Bengal, near north Odisha, in the first week of September. This system is likely to bring rain to north Telangana and the twin cities, according to meteorologists at the Telangana Development Planning Society (TDPS) on Thursday. In fact, August has turned out to be the wettest month in the last five years, with an 80% excess in rainfall - about 36 cm recorded so far this month. The normal rainfall for August in Telangana is typically around 21.6 cm. “We’ve usually seen heavy rainfall in July, and moderate to normal rainfall in August over the past few years. But this year, the pattern has reversed. While July saw just a 5% excess, August has brought heavy to extremely heavy rainfall,” explained senior weather consultant Y.V. Rama Rao in an exclusive interaction. The heavy rains are attributed to a combination of an ‘active’ southwest monsoon and a depression in the Bay of Bengal. The current system is moving towards Chhattisgarh, which could reduce the extent of rainfall, at least, in the capital from tomorrow, he added. 25% excess rainfall so far Districts in north Telangana - Medak, Kamareddy, Nizamabad, Karimnagar and others - have been experiencing heavy rainfall over the past few days. As of now, Telangana has received about 70 cm of rainfall this monsoon season, compared to the normal 56 cm since June 2025, an excess of 25%.",politics,28-Aug-25
Kozhikode MCH to procure surgical devices amid shortage in Cardiology dept.,"The authorities at the Government Medical College Hospital (MCH), Kozhikode, are reportedly making arrangements to procure surgical devices for the Cardiology department, after emergency angioplasty surgeries were stopped following their shortage. “According to sources, the Head of the Department of Cardiology had informed higher officials on Thursday (August 28, 2025) that it would not be possible to offer primary angioplasty to patients with heart disease because of a shortage of balloon-tipped catheters and mesh wires, which are used to widen narrowed or blocked blood vessels and place stents. Doctors in the department had said that only thrombolysis — a procedure in which blood clots are dissolved to restore normal blood flow — could be offered as treatment for heart attacks. The department also clarified that all",science,28-Aug-25
"Govt. would always stand by contractors, says Udhayanidhi","Hailing the role played by contractors in boosting infrastructure in the State, Deputy Chief Minister Udhayanidhi Stalin on Thursday said the State government would always stand by them. Chief Minister M.K. Stalin would take the State to greater heights by joining hands with contractors, Mr. Udhayanidhi said. Addressing the second State convention of the Tamil Nadu Highways Contractors’ Federation at Chennai Trade Centre, Mr. Udhayanidhi said there were many issues that contractors faced during the previous [AIADMK] government for over 10 years. “But under the DMK government of our Chief Minister, we can say it is a golden period for contractors.” Earlier, he inaugurated CONEX South 2025, an infrastructure construction machinery exhibition. He released the souvenir of the second State convention of the Tamil Nadu Highways Contractors Federation. Listing measures undertaken by the DMK government to benefit contractors, Mr. Udhayanidhi said the government and the Chief Minister would implement more measures to benefit them. “Our Minister concerned would definitely discuss with the Chief Minister and ensure that such measures benefit you.” In his speech, Minister for Public",politics,28-Aug-25
Retired elderly couple duped of life savings in ‘virtual arrest’ scam in Kasaragod,"An elderly couple, both retired government employees, lost ?2.4 crore after reportedly being held under “virtual arrest” for 11 days by alleged cyber fraudsters in Kanhangad in Kasaragod. According to the police, the victims are a 69-year-old retired teacher and his 72-year-old wife, a retired government homeopathy doctor. The couple live alone in a rented house at Kanhangad. “It was on the morning of August 10 that my wife received a call from an international number. The caller said she was involved in a money laundering case being investigated by the Central Bureau of Investigation [CBI],” the retired teacher said, requesting anonymity. The scammers allegedly displayed a fake Aadhaar card and said the couple was under “virtual arrest. On August 12, the couple was reportedly told that their case would be heard virtually by a CBI court in Mumbai. They were then asked to transfer all their savings for ‘verification,’ with the assurance that the money would be deposited in accounts belonging to the Supreme Court. Between August 19 and 21, the couple transferred ?2.4 crore in four transactions as directed. They realised it was a scam only after a relative visited their home, following which they alerted the police. The Kasaragod Cyber police registered a case on August 22 under Section 316(4) of the Bharatiya Nyaya Sanhita and Section 66(D) of the Information Technology Act. Published - August 28, 2025 11:55 pm IST",sports,28-Aug-25
Bandi Sanjay hands over financial assistance to flood-affected family,"Union Minister of State for Home Affairs Bandi Sanjay Kumar praised the tireless rescue efforts of the NDRF teams and the swift rescue operation by the IAF choppers in the flood-affected areas of Rajanna Sircilla district on Thursday. He was speaking to the media after visiting the flood-affected families in Narmala in Gambhiraopet mandal on Thursday afternoon, shortly after two IAF choppers airlifted five stranded cattle grazers of Narmala village to safety. He thanked Defence Minister Rajnath Singh for deploying two helicopters for rescue and relief operations. He commended the relentless efforts of Collector Sandeep Kumar Jha and Superintendent of Police Gite",sports,28-Aug-25
